{
  "registry_version": "0.2.0",
  "status": "candidate",
  "capabilities": [
    {
      "id": "architecture_reasoning",
      "description": "Design and red-team system boundaries, invariants, and rollout gates."
    },
    {
      "id": "bounded_evidence_inventory",
      "description": "Collect exact bounded evidence without interpretation or scope expansion."
    },
    {
      "id": "contract_and_roadmap_mapping",
      "description": "Map task dependencies, contracts, and next-stage acceptance gates."
    },
    {
      "id": "root_cause_analysis",
      "description": "Distinguish symptoms from the causal implementation or harness defect."
    },
    {
      "id": "governance_authority_safety",
      "description": "Preserve authority, promotion, and human-gate boundaries."
    },
    {
      "id": "validation_design",
      "description": "Define deterministic checks that fail closed at the intended boundary."
    },
    {
      "id": "implementation_review",
      "description": "Review code or artifacts for correctness, regressions, and missing tests."
    },
    {
      "id": "escalation_judgment",
      "description": "Recognize uncertainty, hard cases, and the appropriate higher review lane."
    },
    {
      "id": "project_identity_and_related_work",
      "description": "Preserve project and workstream identities while finding candidate continuations, siblings, experiments, contradictions, and possible duplicates within explicit coverage."
    },
    {
      "id": "workstream_planning",
      "description": "Shape promoted outcomes into bounded workstreams, non-goals, next actions, acceptance evidence, and execution-boundary proposals."
    },
    {
      "id": "dependency_frontier_analysis",
      "description": "Separate proposed from reviewed dependency edges, detect cycles and blocked chains, and identify a candidate unlock frontier without treating centrality as truth."
    },
    {
      "id": "portfolio_attention_curatorship",
      "description": "Build humane candidate Today, WIP, Kanban, and optional Scrum-focus projections while preserving quiet states and overflow."
    },
    {
      "id": "research_project_management",
      "description": "Manage research questions through source coverage, evidence and counterevidence, falsification, uncertainty, synthesis, and decision readiness."
    },
    {
      "id": "neglected_work_recovery",
      "description": "Reconstruct intent and evidence for dirty, stale, blocked, waiting, superseded, or unknown branches and worktrees without age-only abandonment claims."
    },
    {
      "id": "trigger_pattern_discovery",
      "description": "Discover and deduplicate versioned trigger signatures with suppressors, cooldowns, authority gates, negative cases, rollback, and kill criteria."
    },
    {
      "id": "trigger_trial_evaluation",
      "description": "Independently evaluate trigger trials for useful-action precision, misses, dismissals, harm, compute fit, authority compliance, and drift."
    },
    {
      "id": "child_project_sovereignty",
      "description": "Review child-project authority transitions, delivery boundaries, retained upstream responsibility, and rollback under explicit human approval."
    },
    {
      "id": "delivery_validation_and_handoff",
      "description": "Reconcile acceptance evidence, independent validation, residual risks, ownership, rollback, delivery readiness, and resume capsules."
    },
    {
      "id": "pre_outcome_self_prediction",
      "description": "Capture criterion-level actor-claimed predictions, confidence, falsifiers, and limitations; only an orchestrator-controlled seal may establish outcome blindness, and no self-grade has authority."
    },
    {
      "id": "evaluator_integrity_audit",
      "description": "Audit available reviewer identity, lineage, cycle, and anti-gaming evidence while explicitly failing closed when blindness, replay, qualification, or outcome truth is not attested."
    },
    {
      "id": "improvement_layer_attribution",
      "description": "Frame competing agent, model, tool, input, data, workflow, handoff, evaluator, domain, and downstream-layer hypotheses; localize a cause only with deterministic evidence or a seeded ablation."
    },
    {
      "id": "domain_evaluation_profile_stewardship",
      "description": "Select and maintain context-bounded domain evaluation overlays with applicability, non-applicability, expert, and cross-domain-comparison limits."
    },
    {
      "id": "preserve_simple_workflow_design",
      "description": "Protect a narrow deterministic role from prompt bloat; a freeze requires executable criterion outcomes, negative cases, latency/cost evidence, held-out confirmation, and human approval."
    },
    {
      "id": "manifest_authority_modeling",
      "description": "Define a structured artifact's mission, authoritative sources, scope, consumers, sensitivity, non-goals, and human gates before schema or implementation work."
    },
    {
      "id": "identity_address_ontology_design",
      "description": "Separate stable, revision, alias, and display identities while defining address grammars, ontology terms, collision handling, and namespace authority."
    },
    {
      "id": "dependency_dataflow_extraction",
      "description": "Extract deterministic dependency and data-flow observations with explicit coverage while separating observations from inferred candidate edges."
    },
    {
      "id": "typed_graph_provenance_modeling",
      "description": "Define typed nodes and edges with provenance, confidence, review state, evidence direction, and forbidden authority inferences."
    },
    {
      "id": "schema_contract_engineering",
      "description": "Design strict structured-artifact schemas, invariants, compatibility, migrations, and fail-closed negative cases."
    },
    {
      "id": "deterministic_projection_building",
      "description": "Build reproducible manifests and graph projections from immutable source observations under one bounded writer scope."
    },
    {
      "id": "semantic_fingerprint_freshness",
      "description": "Bind source coverage, semantic digests, versions, freshness states, rebuild triggers, and unsupported-input behavior."
    },
    {
      "id": "reverse_blast_radius_analysis",
      "description": "Trace changed names, schemas, authority, builders, and outputs through reverse dependencies to affected and unknown consumers."
    },
    {
      "id": "query_mcp_projection_design",
      "description": "Design bounded read-only query or MCP projections with strict output schemas, privacy filters, and no execution authority."
    },
    {
      "id": "structured_artifact_independent_audit",
      "description": "Independently test structured artifacts for deterministic replay, schema and authority drift, privacy, freshness, missing consumers, and writer-checker separation."
    },
    {
      "id": "digital_asset_discovery",
      "description": "Inventory concrete reusable asset candidates and coverage without changing sources or treating mere existence as value."
    },
    {
      "id": "asset_identity_revision_stewardship",
      "description": "Separate stable asset, revision, variant, package, deployment, and observation identities while surfacing ambiguous merges."
    },
    {
      "id": "asset_taxonomy_classification",
      "description": "Apply evidence-backed multi-label asset facets while preserving unknown, unclassified, conflicting, and proposed taxonomy values."
    },
    {
      "id": "asset_provenance_license_privacy",
      "description": "Review asset origin, derivation, ownership, license, sensitivity, release, security, and compatibility without exposing protected content."
    },
    {
      "id": "asset_deduplication_variant_synergy",
      "description": "Distinguish exact duplicates, containment, revisions, variants, complements, conflicts, and combinations without using similarity as identity."
    },
    {
      "id": "asset_evidence_value_adoption",
      "description": "Assess validation, usefulness, applicability, maintenance cost, adoption, counterevidence, and do-not-apply limits without universal scores."
    },
    {
      "id": "asset_lifecycle_routing",
      "description": "Route candidate asset evidence to review, trial, reuse, revision, hold, rejection, supersession, or retirement without downstream application authority."
    },
    {
      "id": "asset_taxonomy_drift_audit",
      "description": "Detect recurring unknowns, contradictory facets, obsolete values, and classification regressions and propose compatible taxonomy revisions."
    },
    {
      "id": "digital_asset_independent_audit",
      "description": "Independently audit asset discovery, identity, taxonomy, provenance, privacy, deduplication, evidence, adoption, and lifecycle routing."
    }
  ],
  "rule": "Capability observations are attempt-scoped candidate evidence. Promotion to a reusable role-profile claim requires the versioned subagent evaluation methodology and human review."
}
